{
  "schemaVersion": 1,
  "title": "CSV export / Project Atlas",
  "scopes": [
    {
      "id": "1a6b72ac-345d-4085-8de0-992a28316488",
      "version": 1,
      "text": "Add CSV export for the currently filtered tasks in this project. Exclude internal notes and leave task data unchanged.",
      "selection": "filtered",
      "excludeNotes": true,
      "preserveTasks": true,
      "confirmedAt": "2026-10-07T19:57:45.965Z",
      "provenance": "observed"
    }
  ],
  "events": [
    {
      "id": "87349ca2-ee6d-4651-a297-63a2c024e0c1",
      "type": "request",
      "title": "Change request received",
      "detail": "Add CSV export for the currently filtered tasks in this project. Exclude internal notes and leave task data unchanged.",
      "occurredAt": "2026-10-07T19:57:46.965Z",
      "receivedAt": "2026-10-07T19:57:46.965Z",
      "sequence": 1,
      "artifactIds": [],
      "provenance": "observed",
      "scopeId": "1a6b72ac-345d-4085-8de0-992a28316488"
    },
    {
      "id": "602b7c0e-fa47-4049-8bee-3eee650c606d",
      "type": "configuration",
      "title": "Export configured",
      "detail": "Injected demonstration fault: the adapter broadened selection to all project tasks.",
      "occurredAt": "2026-10-07T19:57:46.966Z",
      "receivedAt": "2026-10-07T19:57:46.966Z",
      "sequence": 2,
      "artifactIds": [
        "bc33955c-ce92-4aba-97d0-c964dd889187"
      ],
      "provenance": "observed",
      "runId": "00b23b31-03c3-487f-ac2c-7267706e0316",
      "scopeId": "1a6b72ac-345d-4085-8de0-992a28316488"
    },
    {
      "id": "b9d0fd2d-dd8f-4263-acec-2edac193316a",
      "type": "execution",
      "title": "Export completed — 24 rows",
      "detail": "Export generated by the working dashboard.",
      "occurredAt": "2026-10-07T19:57:46.966Z",
      "receivedAt": "2026-10-07T19:57:46.966Z",
      "sequence": 3,
      "artifactIds": [
        "cd5188c5-bda4-4766-af5e-d97c25bbdbc4",
        "9a44514b-3bbd-447f-a563-61c96fdc9be5"
      ],
      "provenance": "observed",
      "runId": "00b23b31-03c3-487f-ac2c-7267706e0316",
      "scopeId": "1a6b72ac-345d-4085-8de0-992a28316488"
    }
  ],
  "runs": [
    {
      "id": "00b23b31-03c3-487f-ac2c-7267706e0316",
      "scopeId": "1a6b72ac-345d-4085-8de0-992a28316488",
      "startedAt": "2026-10-07T19:57:46.965Z",
      "completedAt": "2026-10-07T19:57:46.966Z",
      "config": {
        "selection": "project",
        "includeNotes": false
      },
      "artifactId": "9a44514b-3bbd-447f-a563-61c96fdc9be5",
      "scenario": "divergence",
      "modelMode": "offline",
      "operationId": "9353e692-bde5-4813-bcdf-45607338f138"
    }
  ],
  "artifacts": [
    {
      "id": "bc33955c-ce92-4aba-97d0-c964dd889187",
      "name": "export-configuration.json",
      "kind": "configuration",
      "content": "{\"selection\":\"project\",\"includeNotes\":false}",
      "sha256": "53ee24787c39f96076c6a7202d0d824d63596ef091c80b7982904dd80b499a90"
    },
    {
      "id": "cd5188c5-bda4-4766-af5e-d97c25bbdbc4",
      "name": "task-state.json",
      "kind": "snapshot",
      "content": "{\"before\":[{\"id\":\"T-001\",\"title\":\"Review export requirements 1\",\"project\":\"Atlas\",\"status\":\"open\",\"internalNotes\":\"Synthetic internal note 1\"},{\"id\":\"T-002\",\"title\":\"Implement project filter 2\",\"project\":\"Atlas\",\"status\":\"open\",\"internalNotes\":\"Synthetic internal note 2\"},{\"id\":\"T-003\",\"title\":\"Verify CSV encoding 3\",\"project\":\"Atlas\",\"status\":\"open\",\"internalNotes\":\"Synthetic internal note 3\"},{\"id\":\"T-004\",\"title\":\"Check accessibility 4\",\"project\":\"Atlas\",\"status\":\"open\",\"internalNotes\":\"Synthetic internal note 4\"},{\"id\":\"T-005\",\"title\":\"Review delivery evidence 5\",\"project\":\"Atlas\",\"status\":\"open\",\"internalNotes\":\"Synthetic internal note 5\"},{\"id\":\"T-006\",\"title\":\"Update project documentation 6\",\"project\":\"Atlas\",\"status\":\"open\",\"internalNotes\":\"Synthetic internal note 6\"},{\"id\":\"T-007\",\"title\":\"Review export requirements 7\",\"project\":\"Atlas\",\"status\":\"open\",\"internalNotes\":\"Synthetic internal note 7\"},{\"id\":\"T-008\",\"title\":\"Implement project filter 8\",\"project\":\"Atlas\",\"status\":\"open\",\"internalNotes\":\"Synthetic internal note 8\"},{\"id\":\"T-009\",\"title\":\"Verify CSV encoding 9\",\"project\":\"Atlas\",\"status\":\"open\",\"internalNotes\":\"Synthetic internal note 9\"},{\"id\":\"T-010\",\"title\":\"Check accessibility 10\",\"project\":\"Atlas\",\"status\":\"open\",\"internalNotes\":\"Synthetic internal note 10\"},{\"id\":\"T-011\",\"title\":\"Review delivery evidence 11\",\"project\":\"Atlas\",\"status\":\"open\",\"internalNotes\":\"Synthetic internal note 11\"},{\"id\":\"T-012\",\"title\":\"Update project documentation 12\",\"project\":\"Atlas\",\"status\":\"open\",\"internalNotes\":\"Synthetic internal note 12\"},{\"id\":\"T-013\",\"title\":\"Review export requirements 13\",\"project\":\"Atlas\",\"status\":\"open\",\"internalNotes\":\"Synthetic internal note 13\"},{\"id\":\"T-014\",\"title\":\"Implement project filter 14\",\"project\":\"Atlas\",\"status\":\"open\",\"internalNotes\":\"Synthetic internal note 14\"},{\"id\":\"T-015\",\"title\":\"Verify CSV encoding 15\",\"project\":\"Atlas\",\"status\":\"open\",\"internalNotes\":\"Synthetic internal note 15\"},{\"id\":\"T-016\",\"title\":\"Check accessibility 16\",\"project\":\"Atlas\",\"status\":\"open\",\"internalNotes\":\"Synthetic internal note 16\"},{\"id\":\"T-017\",\"title\":\"Review delivery evidence 17\",\"project\":\"Atlas\",\"status\":\"open\",\"internalNotes\":\"Synthetic internal note 17\"},{\"id\":\"T-018\",\"title\":\"Update project documentation 18\",\"project\":\"Atlas\",\"status\":\"open\",\"internalNotes\":\"Synthetic internal note 18\"},{\"id\":\"T-019\",\"title\":\"Review export requirements 19\",\"project\":\"Atlas\",\"status\":\"closed\",\"internalNotes\":\"Synthetic internal note 19\"},{\"id\":\"T-020\",\"title\":\"Implement project filter 20\",\"project\":\"Atlas\",\"status\":\"closed\",\"internalNotes\":\"Synthetic internal note 20\"},{\"id\":\"T-021\",\"title\":\"Verify CSV encoding 21\",\"project\":\"Atlas\",\"status\":\"closed\",\"internalNotes\":\"Synthetic internal note 21\"},{\"id\":\"T-022\",\"title\":\"Check accessibility 22\",\"project\":\"Atlas\",\"status\":\"closed\",\"internalNotes\":\"Synthetic internal note 22\"},{\"id\":\"T-023\",\"title\":\"Review delivery evidence 23\",\"project\":\"Atlas\",\"status\":\"closed\",\"internalNotes\":\"Synthetic internal note 23\"},{\"id\":\"T-024\",\"title\":\"Update project documentation 24\",\"project\":\"Atlas\",\"status\":\"closed\",\"internalNotes\":\"Synthetic internal note 24\"}],\"after\":[{\"id\":\"T-001\",\"title\":\"Review export requirements 1\",\"project\":\"Atlas\",\"status\":\"open\",\"internalNotes\":\"Synthetic internal note 1\"},{\"id\":\"T-002\",\"title\":\"Implement project filter 2\",\"project\":\"Atlas\",\"status\":\"open\",\"internalNotes\":\"Synthetic internal note 2\"},{\"id\":\"T-003\",\"title\":\"Verify CSV encoding 3\",\"project\":\"Atlas\",\"status\":\"open\",\"internalNotes\":\"Synthetic internal note 3\"},{\"id\":\"T-004\",\"title\":\"Check accessibility 4\",\"project\":\"Atlas\",\"status\":\"open\",\"internalNotes\":\"Synthetic internal note 4\"},{\"id\":\"T-005\",\"title\":\"Review delivery evidence 5\",\"project\":\"Atlas\",\"status\":\"open\",\"internalNotes\":\"Synthetic internal note 5\"},{\"id\":\"T-006\",\"title\":\"Update project documentation 6\",\"project\":\"Atlas\",\"status\":\"open\",\"internalNotes\":\"Synthetic internal note 6\"},{\"id\":\"T-007\",\"title\":\"Review export requirements 7\",\"project\":\"Atlas\",\"status\":\"open\",\"internalNotes\":\"Synthetic internal note 7\"},{\"id\":\"T-008\",\"title\":\"Implement project filter 8\",\"project\":\"Atlas\",\"status\":\"open\",\"internalNotes\":\"Synthetic internal note 8\"},{\"id\":\"T-009\",\"title\":\"Verify CSV encoding 9\",\"project\":\"Atlas\",\"status\":\"open\",\"internalNotes\":\"Synthetic internal note 9\"},{\"id\":\"T-010\",\"title\":\"Check accessibility 10\",\"project\":\"Atlas\",\"status\":\"open\",\"internalNotes\":\"Synthetic internal note 10\"},{\"id\":\"T-011\",\"title\":\"Review delivery evidence 11\",\"project\":\"Atlas\",\"status\":\"open\",\"internalNotes\":\"Synthetic internal note 11\"},{\"id\":\"T-012\",\"title\":\"Update project documentation 12\",\"project\":\"Atlas\",\"status\":\"open\",\"internalNotes\":\"Synthetic internal note 12\"},{\"id\":\"T-013\",\"title\":\"Review export requirements 13\",\"project\":\"Atlas\",\"status\":\"open\",\"internalNotes\":\"Synthetic internal note 13\"},{\"id\":\"T-014\",\"title\":\"Implement project filter 14\",\"project\":\"Atlas\",\"status\":\"open\",\"internalNotes\":\"Synthetic internal note 14\"},{\"id\":\"T-015\",\"title\":\"Verify CSV encoding 15\",\"project\":\"Atlas\",\"status\":\"open\",\"internalNotes\":\"Synthetic internal note 15\"},{\"id\":\"T-016\",\"title\":\"Check accessibility 16\",\"project\":\"Atlas\",\"status\":\"open\",\"internalNotes\":\"Synthetic internal note 16\"},{\"id\":\"T-017\",\"title\":\"Review delivery evidence 17\",\"project\":\"Atlas\",\"status\":\"open\",\"internalNotes\":\"Synthetic internal note 17\"},{\"id\":\"T-018\",\"title\":\"Update project documentation 18\",\"project\":\"Atlas\",\"status\":\"open\",\"internalNotes\":\"Synthetic internal note 18\"},{\"id\":\"T-019\",\"title\":\"Review export requirements 19\",\"project\":\"Atlas\",\"status\":\"closed\",\"internalNotes\":\"Synthetic internal note 19\"},{\"id\":\"T-020\",\"title\":\"Implement project filter 20\",\"project\":\"Atlas\",\"status\":\"closed\",\"internalNotes\":\"Synthetic internal note 20\"},{\"id\":\"T-021\",\"title\":\"Verify CSV encoding 21\",\"project\":\"Atlas\",\"status\":\"closed\",\"internalNotes\":\"Synthetic internal note 21\"},{\"id\":\"T-022\",\"title\":\"Check accessibility 22\",\"project\":\"Atlas\",\"statu